{
  "$schema": "./schemas/readiness-score.schema.json",
  "status": "pass",
  "readiness_score": 50,
  "readiness_band": "Elite Orchestration",
  "dimensions": {
    "scope_clarity": {
      "score": 5,
      "evidence": [
        "All subagents in .claude/agents/*.md define strict directory scopes under 'Security Controls' and routing triggers.",
        "Settings file .claude/settings.json specifies precise global path exclusions."
      ],
      "fix": ""
    },
    "routing_description_quality": {
      "score": 5,
      "evidence": [
        "Subagents contain descriptive frontmatter detail outlining exact trigger queries, files/folders targeted, and expected output formats."
      ],
      "fix": ""
    },
    "tool_minimality": {
      "score": 5,
      "evidence": [
        "Read-only auditor roles strictly disallow Write, Edit, Bash, and Agent tools.",
        "Execution verifier role disallows Write, Edit, and Agent tools, preventing untracked edits."
      ],
      "fix": ""
    },
    "reasoning_depth": {
      "score": 5,
      "evidence": [
        "Model calibration aligns Opus with High effort for safety, chart, and security reviewers.",
        "Sonnet with Medium effort is mapped to verifier; Haiku with Low effort is mapped to researcher."
      ],
      "fix": ""
    },
    "context_efficiency": {
      "score": 5,
      "evidence": [
        "Compacted CLAUDE.md remains under 130 lines and points technical context to committed docs rather than gitignored local planning paths.",
        "Path-scoped rules in .claude/rules/ now use the Claude Code paths frontmatter key for lazy-loading in active developer contexts.",
        "node .claude/workflows/arena-audit.js validates paths-based rule frontmatter with 0 findings."
      ],
      "fix": ""
    },
    "verification_discipline": {
      "score": 5,
      "evidence": [
        "Created .claude/commands/verify-changes.md to define the closed-loop verification pipeline.",
        "Created /gsd-quick, /gsd-debug, and /gsd-execute-phase commands so CLAUDE.md workflow entry points resolve.",
        "Structural audit completed with 0 findings after the paths frontmatter migration."
      ],
      "fix": ""
    },
    "safety_controls": {
      "score": 5,
      "evidence": [
        "Settings file .claude/settings.json implements robust allow/deny lists, including PowerShell-native variants.",
        "pre-tool-use.js lifecycle hook checks shell commands and edits against regex security pattern arrays."
      ],
      "fix": ""
    },
    "maintainability": {
      "score": 5,
      "evidence": [
        "Modular directory structure cleanly separates agents, commands, hooks, rules, schemas, and skills.",
        "settings.local.json.example preserves the shared disableSkillShellExecution safety default and .claude/README.md documents explicit opt-in risk.",
        "CLAUDE.md read-order wording clarifies that AGENTS.md is a human reference document, not an automatic import."
      ],
      "fix": ""
    },
    "handoff_quality": {
      "score": 5,
      "evidence": [
        "Created .claude/schemas/handoff.schema.json defining the structure of inter-agent handoff payloads.",
        "Subagent manifests contain instructions requiring state serialization adhering to the handoff schema."
      ],
      "fix": ""
    },
    "source_grounding": {
      "score": 5,
      "evidence": [
        "Mapped blueprint concerns to framework surfaces in docs/FRAMEWORK_TRACEABILITY.md.",
        "No undocumented claims or unmapped variables left."
      ],
      "fix": ""
    }
  },
  "critical_findings": [],
  "recommended_edits": [],
  "verification_evidence": [
    "Run node .claude/workflows/arena-audit.js on 2026-06-03: status complete, 0 findings, rules 32, commands 8, skills 4, agents 5, hooks 2, workflows 1, outputStyles 4.",
    "Run rg -n \"^globs:\" .claude/rules/*.md: no legacy globs frontmatter remains.",
    "Run rg -n \"^paths:\" .claude/rules/*.md | wc -l: 32 paths-scoped rule files found."
  ],
  "residual_risks": []
}
